{
  "typeOfLoss":"foreign-property",
  "businessId": "X2IS12356589871",
  "typeOfClaim": "carry-sideways",
  "taxYear": "2019-20",
  "lastModified" : "2020-07-11T12:13:48.763Z",
  "links": [
    {
      "href": "/individuals/losses/TC663795B/loss-claims/1234568790ABCDE",
      "rel": "self",
      "method": "GET"
    }
  ]
}